{
  "$schema": "https://json-schema.org/draft/2020-12/schema",
  "$id": "https://pdca.local/schemas/task.schema.json",
  "title": "PDCA strict task",
  "type": "object",
  "additionalProperties": false,
  "required": [
    "id",
    "slug",
    "title",
    "parent",
    "children",
    "status",
    "meta",
    "states"
  ],
  "properties": {
    "id": {
      "type": "string",
      "pattern": "^T[0-9]{4,}$"
    },
    "slug": {
      "type": "string",
      "pattern": "^[0-9]{4}-[a-z0-9][a-z0-9-]*$"
    },
    "title": {
      "type": "string",
      "minLength": 1
    },
    "parent": {
      "type": [
        "string",
        "null"
      ],
      "pattern": "^T[0-9]{4,}$"
    },
    "children": {
      "type": "array",
      "items": {
        "type": "string",
        "pattern": "^T[0-9]{4,}$"
      },
      "uniqueItems": true
    },
    "dependencies": {
      "type": "array",
      "items": {
        "type": "string",
        "pattern": "^T[0-9]{4,}$"
      },
      "uniqueItems": true,
      "default": []
    },
    "status": {
      "enum": [
        "Pending",
        "InProgress",
        "Completed"
      ]
    },
    "meta": {
      "type": "object",
      "additionalProperties": false,
      "required": [
        "phase",
        "active",
        "ontology_role",
        "created_at",
        "convergence"
      ],
      "properties": {
        "phase": {
          "enum": [
            "plan",
            "do",
            "check",
            "act",
            "archive"
          ]
        },
        "active": {
          "type": "boolean"
        },
        "ontology_role": {
          "enum": [
            "ontology_modeling",
            "ontology_projection",
            "ontology_conformance_verification"
          ]
        },
        "execution_contract": {
          "type": "object",
          "additionalProperties": false,
          "required": ["work_product", "required_actions", "constraints", "testable_signal"],
          "properties": {
            "work_product": {"type": "string", "minLength": 1},
            "required_actions": {"type": "array", "items": {"type": "string", "minLength": 1}, "minItems": 1},
            "constraints": {"type": "array", "items": {"type": "string", "minLength": 1}},
            "testable_signal": {"type": "string", "minLength": 1}
          }
        },
        "created_at": {
          "type": "string",
          "format": "date-time"
        },
        "convergence": {
          "type": "array",
          "items": {
            "type": "string",
            "minLength": 1
          },
          "minItems": 1,
          "uniqueItems": true
        },
        "improvement_source": {
          "$ref": "#/$defs/improvement_source"
        },
        "completed_at": {
          "type": "string",
          "format": "date-time"
        },
        "record": {
          "type": "string",
          "pattern": "^[A-Za-z0-9][A-Za-z0-9._-]*$"
        },
        "verdict": {
          "$ref": "#/$defs/verdict"
        },
        "disposition": {
          "$ref": "#/$defs/disposition"
        },
        "ontology_fragment": {
          "type": [
            "string",
            "null"
          ],
          "description": "本任务构建/引用的领域本体片段路径（相对仓库根），do 前置 ontology-ready 关卡校验其存在且结构合法"
        },
        "ontology_exempt": {
          "type": "boolean",
          "description": "本体自举任务豁免 ontology-ready（如创建 PDCA 元本体本身），需同时提供 ontology_exempt_reason"
        },
        "ontology_exempt_reason": {
          "type": "string",
          "minLength": 20,
          "description": "豁免理由（≥20字符，须含ontology关键词），仅当 ontology_exempt=true 时必填，白名单仅本体自举"
        },
        "ontology_node_type": {
          "type": ["string", "null"],
          "enum": [
            "domain", "entity", "concept", "process", "role",
            "pattern", "principle", "pitfall", "fact", "decision", null
          ],
          "description": "本任务主体产出的本体节点类型，使「任务类型 ↔ 本体节点类型」成为结构化关系，供拆分/计划/检索引用"
        },
        "ontology_anchor": {
          "type": ["string", "null"],
          "description": "任务锚定的本体元概念节点 id（默认 ontology:concept/pdca-task），使任务表达挂接本体图谱、消费 pdca-task 元概念的不变量"
        },
        "extensions": {
          "type": "object",
          "description": "自由扩展区（ontology:concept/template-minimal）：供 AI 发散假设与新概念先行，门禁跳过其内容校验",
          "additionalProperties": true,
          "default": {}
        },
        "steps": {
          "type": "array",
          "description": "技能/流程的可执行步骤序列",
          "items": {
            "type": "object",
            "additionalProperties": false,
            "required": ["name", "description", "completion_criterion"],
            "properties": {
              "name": {"type": "string", "minLength": 1},
              "description": {"type": "string", "minLength": 1},
              "completion_criterion": {"type": "string", "minLength": 1}
            }
          },
          "uniqueItems": true,
          "default": []
        },
        "completion_criteria": {
          "type": "array",
          "description": "任务完成的判定条件列表，需清晰且有需求强度",
          "items": {"type": "string", "minLength": 1},
          "minItems": 1,
          "uniqueItems": true,
          "default": []
        }
      },
      "allOf": [
        {
          "if": {
            "properties": {"ontology_exempt": {"const": true}},
            "required": ["ontology_exempt"]
          },
          "then": {"required": ["ontology_exempt_reason"]}
        }
      ]
    },
    "states": {
      "type": "object",
      "additionalProperties": false,
      "required": [
        "created",
        "plan",
        "do",
        "check",
        "act",
        "archive"
      ],
      "properties": {
        "created": {
          "type": "string",
          "format": "date-time"
        },
        "plan": {
          "type": [
            "string",
            "null"
          ],
          "format": "date-time"
        },
        "do": {
          "type": [
            "string",
            "null"
          ],
          "format": "date-time"
        },
        "check": {
          "type": [
            "string",
            "null"
          ],
          "format": "date-time"
        },
        "act": {
          "type": [
            "string",
            "null"
          ],
          "format": "date-time"
        },
        "archive": {
          "type": [
            "string",
            "null"
          ],
          "format": "date-time"
        }
      }
    }
  },
  "$defs": {
    "verdict": {
      "type": "object",
      "additionalProperties": false,
      "required": [
        "outcome",
        "reason",
        "verdict_id",
        "at"
      ],
      "properties": {
        "outcome": {
          "enum": [
            "confirmed",
            "rejected",
            "partial"
          ]
        },
        "reason": {
          "type": "string",
          "minLength": 1
        },
        "verdict_id": {
          "type": "string",
          "minLength": 1
        },
        "at": {
          "type": "string",
          "format": "date-time"
        }
      }
    },
    "disposition": {
      "type": "object",
      "additionalProperties": false,
      "required": [
        "outcome",
        "reason",
        "at"
      ],
      "properties": {
        "outcome": {
          "enum": [
            "projected",
            "not_reusable",
            "task_only"
          ]
        },
        "reason": {
          "type": "string",
          "minLength": 1
        },
        "at": {
          "type": "string",
          "format": "date-time"
        }
      }
    },
    "improvement_source": {
      "type": "object",
      "additionalProperties": false,
      "required": [
        "record_id",
        "issue_id",
        "candidate_id",
        "decision_id"
      ],
      "properties": {
        "record_id": {
          "type": "string",
          "pattern": "^[A-Za-z0-9][A-Za-z0-9._-]*$"
        },
        "issue_id": {
          "type": "string",
          "pattern": "^FI-[0-9a-f]{24}$"
        },
        "candidate_id": {
          "type": "string",
          "pattern": "^FC-[0-9a-f]{24}$"
        },
        "decision_id": {
          "type": "string",
          "pattern": "^FD-[0-9a-f]{24}$"
        }
      }
    }
  }
}
