{
  "children": [],
  "dependencies": [],
  "id": "T0477",
  "meta": {
    "active": false,
    "convergence": [
      "ReportCenter 树：report-center-system composed_of 2叶",
      "Backup 树：backup-system composed_of 2叶",
      "森林可调度：tree_split 与 frontier 对新树可调度"
    ],
    "created_at": "2026-09-01T08:05:00+08:00",
    "ontology_anchor": "ontology:concept/pdca-task",
    "ontology_fragment": "ontology",
    "ontology_node_type": "entity",
    "phase": "archive",
    "record": "T0477-0902-ontology-existing-tree",
    "steps": [
      {
        "name": "ReportCenter 树",
        "description": "新建 report-center-system 3节点",
        "completion_criterion": "composed_of 2叶，validate 0 issues"
      },
      {
        "name": "Backup 树",
        "description": "新建 backup-system 3节点",
        "completion_criterion": "graph 含 2条新边"
      },
      {
        "name": "森林验证",
        "description": "tree_split 与 frontier 对新树",
        "completion_criterion": "batches [[2叶],[父]] valid:true"
      }
    ],
    "verdict": {
      "outcome": "confirmed",
      "reason": "3AC全绿，6新entity森林可调度",
      "verdict_id": "v0477-confirmed",
      "at": "2026-09-01T08:07:10+08:00"
    },
    "completed_at": "2026-09-01T08:07:11+08:00",
    "disposition": {
      "outcome": "projected",
      "reason": "ontology:entity/report-center-system 与 ontology:entity/backup-system 已沉淀，6 entity 森林可复制",
      "at": "2026-09-01T08:07:13+08:00"
    },
    "ontology_role": "ontology_projection"
  },
  "parent": null,
  "slug": "0902-ontology-existing-tree",
  "states": {
    "act": "2026-09-01T08:07:13+08:00",
    "archive": "2026-09-01T08:07:15+08:00",
    "check": "2026-09-01T08:07:11+08:00",
    "created": "2026-09-01T08:05:00+08:00",
    "do": "2026-09-01T08:06:31+08:00",
    "plan": "2026-09-01T08:05:00+08:00"
  },
  "status": "Completed",
  "title": "既有领域 composed_of 树补齐"
}
