{
  "children": [],
  "dependencies": [],
  "id": "T2051",
  "meta": {
    "active": true,
    "convergence": [
      "双投射已落地且三检可过"
    ],
    "created_at": "2026-09-04T16:04:56+08:00",
    "ontology_anchor": "ontology:concept/pdca-task",
    "ontology_fragment": "ontology",
    "phase": "plan",
    "record": "T2051-0904-template-projection",
    "ontology_role": "ontology_projection"
  },
  "parent": "T2049",
  "slug": "0904-template-projection",
  "states": {
    "act": null,
    "archive": null,
    "check": null,
    "created": "2026-09-04T16:04:56+08:00",
    "do": null,
    "plan": "2026-09-04T16:04:56+08:00"
  },
  "status": "Pending",
  "title": "P1投射：extensions与豁免标记双投射"
}
