{"children":[],"dependencies":[],"id":"T2172","meta":{"active":true,"convergence":["执行契约字段与关系完整","工具仅作为适配器","契约可派生实现接口"],"created_at":"2026-09-11T13:51:00+08:00","execution_contract":{"constraints":["工具不决定业务范围","契约字段必须可机器读取"],"required_actions":["定义契约字段语义","定义契约与任务及证据关系","定义执行适配器边界"],"testable_signal":"执行契约四字段及适配器边界可由本体读取","work_product":"PDCA 执行契约本体"},"ontology_anchor":"ontology:concept/pdca-execution-contract","ontology_fragment":"ontology","ontology_node_type":"concept","ontology_role":"ontology_modeling","phase":"plan","record":"T2172-0911-pdca-execution-contract-model"},"parent":"T2170","slug":"0911-pdca-execution-contract-model","states":{"act":null,"archive":null,"check":null,"created":"2026-09-11T13:51:00+08:00","do":null,"plan":"2026-09-11T13:51:00+08:00"},"status":"Pending","title":"建模 PDCA 执行契约 ontology:concept/pdca-execution-contract"}
