{
  "children": [],
  "dependencies": [],
  "id": "T2069",
  "meta": {
    "active": true,
    "convergence": [
      "代码→本体自动生成：scripts/ontology-generate.py可执行，生成本体通过validate",
      "本体→代码回测验证：scripts/ontology-backtest.py可执行，检测到不可执行signal输出报告",
      "持续监控与告警：scripts/ontology-drift-monitor.py可执行，CI中漂移时非0退出",
      "本体-代码版本联动：frontmatter新增code_version字段，scripts/ontology-version-link.py可执行",
      "影响分析：scripts/ontology-impact.py可执行，代码变更时识别影响的本体节点",
      "覆盖率度量：scripts/ontology-coverage.py可执行，输出覆盖率报告",
      "端到端验证：6个方向全部通过validate-convergence"
    ],
    "created_at": "2026-09-07T11:00:00+08:00",
    "ontology_anchor": "ontology:concept/pdca-task",
    "ontology_fragment": "ontology/concept",
    "ontology_node_type": "concept",
    "phase": "do",
    "record": "T2069-0907-ontology-full-lifecycle",
    "steps": [
      {
        "name": "代码→本体自动生成",
        "description": "开发scripts/ontology-generate.py，从代码静态分析生成本体草案",
        "completion_criterion": "ontology-generate.py可执行，生成本体通过validate --check all"
      },
      {
        "name": "本体→代码回测验证",
        "description": "开发scripts/ontology-backtest.py，定期用testable_signal回测代码",
        "completion_criterion": "backtest.py可执行，检测到不可执行signal输出报告"
      },
      {
        "name": "持续监控与告警",
        "description": "开发scripts/ontology-drift-monitor.py，CI中检测本体-代码漂移",
        "completion_criterion": "drift-monitor.py可执行，漂移时非0退出"
      },
      {
        "name": "本体-代码版本联动",
        "description": "frontmatter新增code_version字段，开发scripts/ontology-version-link.py",
        "completion_criterion": "version-link.py可执行，code_version字段正确"
      },
      {
        "name": "影响分析",
        "description": "开发scripts/ontology-impact.py，代码变更时识别影响的本体节点",
        "completion_criterion": "impact.py可执行，输出影响图谱"
      },
      {
        "name": "覆盖率度量",
        "description": "开发scripts/ontology-coverage.py，统计代码到本体覆盖比率",
        "completion_criterion": "coverage.py可执行，输出覆盖率报告"
      },
      {
        "name": "端到端验证",
        "description": "6个方向全部验证通过",
        "completion_criterion": "validate-convergence valid:true"
      }
    ],
    "ontology_role": "ontology_projection"
  },
  "parent": null,
  "slug": "0907-ontology-full-lifecycle",
  "states": {
    "act": null,
    "archive": null,
    "check": null,
    "created": "2026-09-07T11:00:00+08:00",
    "do": "2026-09-07T11:05:00+08:00",
    "plan": "2026-09-07T11:00:00+08:00"
  },
  "status": "InProgress",
  "title": "本体全生命周期保真：从代码生成到持续监控"
}
